{
  "schema_version": "rolefox.pre-w1-research-protocol.v1",
  "protocol_version": "pre-w1-v0.1-sole-maintainer-1",
  "canonicalization": "rolefox-canonical-digest-v1",
  "status": "APPROVED",
  "approval": {
    "signed_payload_digest": "e1e848391bccfdfb97565cf929fbb67224c51b29700525f7c60daa281000894d",
    "approved_by": "github:AnnCYW-cm",
    "approved_at": "2026-09-13T05:14:00.000Z",
    "approver_role_version": "rolefox-sole-maintainer-v1",
    "approval_proof_digest": "a4bea5a911d661d2d79e36ab193837d6957655555e4c53931526ff756905faf1"
  },
  "decision_authority": {
    "governance_mode": "SOLE_MAINTAINER",
    "identity": "github:AnnCYW-cm",
    "role_version": "rolefox-sole-maintainer-v1",
    "gate_submitter_may_decide": true,
    "trusted_signer_policy": "GITHUB_ACTIONS_OIDC_PROTECTED_MAIN"
  },
  "collection_guard": "NO_RECRUITMENT_OR_EVIDENCE_COLLECTION_BEFORE_APPROVAL",
  "privacy": {
    "public_repository_content": "DEIDENTIFIED_MANIFESTS_AND_DIGESTS_ONLY",
    "raw_interviews_and_mappings": "CONTROLLED_ARTIFACT_STORE_ONLY",
    "participant_identifier": "RANDOM_COHORT_LOCAL_SURROGATE",
    "forbidden_public_fields": [
      "name",
      "email",
      "resume_text",
      "message_text",
      "calendar_content",
      "credential",
      "direct_external_id"
    ]
  },
  "cohorts": {
    "pain_interviews": {
      "target_minimum": 6,
      "target_maximum": 8,
      "qualification_window": "ACTIVE_JOB_SEARCH_WITHIN_PREVIOUS_3_MONTHS",
      "pass_numerator_minimum": 5,
      "pass_criteria": {
        "opportunities_per_week_minimum": 10,
        "repetitive_work_rank_maximum": 3
      }
    },
    "target_channel_feasibility": {
      "eligible_n_minimum": 5,
      "eligibility_all_of": [
        "CURRENTLY_JOB_SEARCHING",
        "APPLICATIONS_PRIMARILY_ONLINE",
        "RECRUITING_COMMUNICATION_CAN_REACH_EMAIL",
        "WILLING_TO_CONNECT_REAL_MAILBOX",
        "WILLING_TO_CONNECT_ONE_REAL_CALENDAR_PROVIDER"
      ],
      "counting_rule": "SEPARATE_DENOMINATOR_FROM_PAIN_INTERVIEWS"
    }
  },
  "rules_replay": {
    "participants_minimum": 5,
    "participant_must_pass_pain_threshold": true,
    "jobs_per_participant": 20,
    "dataset_freeze_before_replay": true,
    "pass_criteria": {
      "explicit_rejection_reasons_covered": "ALL",
      "remaining_ambiguity": "FINITE_EXCEPTION_CATEGORIES"
    }
  },
  "required_outputs": [
    "DEIDENTIFIED_PAIN_INTERVIEW_EVIDENCE",
    "DEIDENTIFIED_TARGET_CHANNEL_ELIGIBILITY_EVIDENCE",
    "FROZEN_PER_PARTICIPANT_JOB_DATASET_DIGESTS",
    "RULE_REPLAY_MEASUREMENTS",
    "COHORT_DENOMINATOR_AND_EXCLUSION_SUMMARY",
    "MAINTAINER_GATE_DECISION_AND_APPROVAL_PROOF"
  ],
  "gate_id": "PRE_W1_PROBLEM_RULES",
  "failure_state": "BLOCKED_NOT_STARTED",
  "protocol_digest": "c2c85eec2ce3bb0b3cc4fd6e1d9555e06a025038d2d6e0bbd30c75eab47346ec"
}
